[
  {
    "label": "cardiac-r00",
    "lead": 3,
    "visible": 2,
    "facets": [
      "prevention",
      "risk_factors"
    ],
    "uncertain": false,
    "rationale": "Dedicated peer-reviewed prevention topic with risk prediction and public-health focus; the snippet identifies its remit, not study findings."
  },
  {
    "label": "cardiac-r01",
    "lead": 3,
    "visible": 1,
    "facets": [
      "prevention"
    ],
    "uncertain": true,
    "rationale": "Title directly names primary and secondary prevention; sparse citation gives no visible detail."
  },
  {
    "label": "cardiac-r02",
    "lead": 2,
    "visible": 3,
    "facets": [
      "risk_factors",
      "lifestyle"
    ],
    "uncertain": false,
    "rationale": "WHO overview names tobacco, diet, obesity, inactivity, alcohol, and pollution as risks; useful background rather than research paper."
  },
  {
    "label": "cardiac-r03",
    "lead": 1,
    "visible": 2,
    "facets": [
      "prevention",
      "lifestyle"
    ],
    "uncertain": false,
    "rationale": "Broad news feed includes meal timing and a care program, but neither appears a focused prevention source."
  },
  {
    "label": "cardiac-r04",
    "lead": 3,
    "visible": 3,
    "facets": [
      "prevention",
      "risk_factors",
      "interventions"
    ],
    "uncertain": false,
    "rationale": "Prevention review excerpt gives statin effect and identifies dyslipidemia, hypertension, and smoking."
  },
  {
    "label": "cardiac-r05",
    "lead": 2,
    "visible": 2,
    "facets": [
      "lifestyle",
      "interventions"
    ],
    "uncertain": true,
    "rationale": "Focused flavanol paper connects diet to prevention and mentions intervention studies, though excerpt is truncated."
  },
  {
    "label": "cardiac-r06",
    "lead": 2,
    "visible": 1,
    "facets": [
      "lifestyle"
    ],
    "uncertain": false,
    "rationale": "Exercise and cardiovascular outcomes is a relevant review-like title; citation snippet supplies no findings."
  },
  {
    "label": "cardiac-r07",
    "lead": 3,
    "visible": 2,
    "facets": [
      "prevention",
      "lifestyle",
      "interventions"
    ],
    "uncertain": true,
    "rationale": "Secondary-prevention roadmap explicitly covers lifestyle and pharmacologic treatment and practice gaps."
  },
  {
    "label": "cardiac-r08",
    "lead": 2,
    "visible": 1,
    "facets": [
      "risk_factors"
    ],
    "uncertain": false,
    "rationale": "Population studies concern causes and prevention, but page is broad coronary research and includes non-prevention trials."
  },
  {
    "label": "cardiac-r09",
    "lead": 3,
    "visible": 1,
    "facets": [
      "prevention"
    ],
    "uncertain": false,
    "rationale": "The review directly targets primary prevention in women; its citation gives no visible risk-factor detail."
  },
  {
    "label": "cardiac-r10",
    "lead": 2,
    "visible": 1,
    "facets": [
      "prevention"
    ],
    "uncertain": false,
    "rationale": "Title names a specific prevention topic; no snippet to establish scope beyond that."
  },
  {
    "label": "cardiac-r11",
    "lead": 3,
    "visible": 2,
    "facets": [
      "prevention",
      "interventions"
    ],
    "uncertain": false,
    "rationale": "Study models 11 recommended prevention activities and intended morbidity, mortality, and cost outcomes."
  },
  {
    "label": "cardiac-r12",
    "lead": 1,
    "visible": 2,
    "facets": [
      "prevention",
      "lifestyle"
    ],
    "uncertain": false,
    "rationale": "Patient-facing disease page notes diet, exercise, stress, and smoking; only indirect research-list value."
  },
  {
    "label": "cardiac-r13",
    "lead": 3,
    "visible": 2,
    "facets": [
      "prevention",
      "lifestyle",
      "interventions"
    ],
    "uncertain": true,
    "rationale": "Record explicitly links lifestyle and pharmacologic approaches to primary and secondary prevention."
  },
  {
    "label": "cardiac-r14",
    "lead": 1,
    "visible": 1,
    "facets": [],
    "uncertain": false,
    "rationale": "The search-result title names cardiovascular prevention, but the snippet is generic NIH boilerplate with no specific result."
  },
  {
    "label": "cardiac-r15",
    "lead": 3,
    "visible": 1,
    "facets": [
      "lifestyle",
      "prevention"
    ],
    "uncertain": false,
    "rationale": "Review title directly concerns healthy lifestyle behaviors in prevention; visible citation alone has little detail."
  },
  {
    "label": "cardiac-r16",
    "lead": 2,
    "visible": 2,
    "facets": [
      "prevention",
      "interventions"
    ],
    "uncertain": false,
    "rationale": "Broad review-like article lists pharmacological and technology interventions plus implementation barriers."
  },
  {
    "label": "cardiac-r17",
    "lead": 2,
    "visible": 1,
    "facets": [
      "risk_factors",
      "prevention"
    ],
    "uncertain": false,
    "rationale": "Research-project listing mentions genetics and risk factors, but no particular study is identified."
  },
  {
    "label": "cardiac-r18",
    "lead": 3,
    "visible": 2,
    "facets": [
      "prevention",
      "interventions"
    ],
    "uncertain": false,
    "rationale": "Preventive cardiology research group expressly studies prevention through drugs, devices, diagnostics, and AI."
  },
  {
    "label": "cardiac-r19",
    "lead": 2,
    "visible": 1,
    "facets": [
      "prevention",
      "interventions"
    ],
    "uncertain": true,
    "rationale": "Connected-health prevention title is a plausible focused lead; bibliographic card has no abstract."
  },
  {
    "label": "cardiac-r20",
    "lead": 2,
    "visible": 1,
    "facets": [
      "risk_factors"
    ],
    "uncertain": true,
    "rationale": "Hormone and cardiovascular disease review title may inform a risk factor; no prevention details are shown."
  },
  {
    "label": "cardiac-r21",
    "lead": 1,
    "visible": 2,
    "facets": [
      "risk_factors",
      "lifestyle"
    ],
    "uncertain": true,
    "rationale": "Snippet reports a preliminary flossing association, peripheral to requested prevention research and framed as early evidence."
  },
  {
    "label": "cardiac-r22",
    "lead": 2,
    "visible": 2,
    "facets": [
      "prevention",
      "lifestyle"
    ],
    "uncertain": false,
    "rationale": "Review excerpt links lycopene-containing foods with prevention and describes disease mechanisms, but focus is narrow."
  },
  {
    "label": "cardiac-r23",
    "lead": 2,
    "visible": 3,
    "facets": [
      "risk_factors",
      "lifestyle"
    ],
    "uncertain": true,
    "rationale": "Research roundup gives sedentary behavior/risk detail and mentions a risk calculator; secondary lead."
  },
  {
    "label": "cardiac-r24",
    "lead": 1,
    "visible": 1,
    "facets": [
      "prevention"
    ],
    "uncertain": false,
    "rationale": "Annual findings roundup mentions prevention areas without identifying a focused source in the snippet."
  },
  {
    "label": "cardiac-r25",
    "lead": 3,
    "visible": 1,
    "facets": [
      "prevention",
      "risk_factors"
    ],
    "uncertain": false,
    "rationale": "AHA scientific statement directly concerns timing of early prevention and cardiovascular risk in menopause."
  },
  {
    "label": "cardiac-r26",
    "lead": 0,
    "visible": 1,
    "facets": [],
    "uncertain": true,
    "rationale": "The title concerns general magnesium prevention and health, without a visible cardiovascular connection."
  },
  {
    "label": "cardiac-r27",
    "lead": 2,
    "visible": 2,
    "facets": [
      "prevention",
      "risk_factors"
    ],
    "uncertain": false,
    "rationale": "AHA summary describes CKM risk calculator and prevention/management statement; useful topical lead."
  },
  {
    "label": "cardiac-r28",
    "lead": 1,
    "visible": 1,
    "facets": [
      "lifestyle"
    ],
    "uncertain": false,
    "rationale": "Exercise screening recommendations concern preparticipation assessment, only indirectly prevention research."
  },
  {
    "label": "cardiac-r29",
    "lead": 2,
    "visible": 2,
    "facets": [
      "prevention",
      "lifestyle",
      "interventions"
    ],
    "uncertain": false,
    "rationale": "Trial directory includes a described church-based lifestyle intervention relevant to prevention."
  },
  {
    "label": "cardiac-r30",
    "lead": 2,
    "visible": 1,
    "facets": [
      "risk_factors"
    ],
    "uncertain": false,
    "rationale": "Hypertension/cardiovascular disease paper is relevant to a major risk factor; snippet lacks its findings."
  },
  {
    "label": "cardiac-r31",
    "lead": 2,
    "visible": 1,
    "facets": [
      "risk_factors"
    ],
    "uncertain": false,
    "rationale": "Professional statement title covers inflammatory markers in public-health practice; prevention link is indirect."
  },
  {
    "label": "cardiac-r32",
    "lead": 2,
    "visible": 2,
    "facets": [
      "prevention",
      "risk_factors"
    ],
    "uncertain": false,
    "rationale": "Study directly examines prevention barriers in a population with elevated CVD risk."
  },
  {
    "label": "cardiac-r33",
    "lead": 2,
    "visible": 3,
    "facets": [
      "prevention",
      "risk_factors",
      "interventions"
    ],
    "uncertain": false,
    "rationale": "Review discusses ML risk assessment, data sources, and precision-prevention possibilities; claims are visible as claims."
  },
  {
    "label": "cardiac-r34",
    "lead": 2,
    "visible": 1,
    "facets": [
      "lifestyle"
    ],
    "uncertain": true,
    "rationale": "The title directly links physical activity across life to cardiovascular disease; no findings are shown."
  },
  {
    "label": "cardiac-r35",
    "lead": 2,
    "visible": 2,
    "facets": [
      "interventions"
    ],
    "uncertain": false,